[
  {
    "name": "Tactical Squad",
    "base_cost": 100,
    "faction": "Legiones Astartes",
    "weapons": ["Bolter"],
    "options": [],
    "rules": ["And They Shall Know No Fear"]
  },
  {
    "name": "Contemptor Dreadnought",
    "base_cost": 175,
    "faction": "Legiones Astartes",
    "weapons": ["Kheres Assault Cannon"],
    "options": [],
    "rules": ["Rending"]
  }
]
